{
  "$schema": "http://json-schema.org/draft-07/schema#",
  "$id": "https://json.schemastore.org/gollama.json",
  "title": "gollama configuration",
  "description": "Configuration for gollama, a terminal user interface for managing Ollama models.\nhttps://github.com/sammcj/gollama#configuration",
  "type": "object",
  "additionalProperties": true,
  "properties": {
    "columns": {
      "description": "Columns to show in the model list.",
      "type": "array",
      "items": {
        "type": "string",
        "minLength": 1
      }
    },
    "ollama_api_key": {
      "description": "API key sent to Ollama-compatible endpoints.",
      "type": "string"
    },
    "ollama_api_url": {
      "description": "Ollama API URL.",
      "type": "string"
    },
    "ollama_models_dir": {
      "description": "Directory containing Ollama model files.",
      "type": "string"
    },
    "log_level": {
      "description": "Logging level.",
      "type": "string"
    },
    "log_file_path": {
      "description": "Path to the log file.",
      "type": "string"
    },
    "sort_order": {
      "description": "Default model sort order.",
      "type": "string"
    },
    "strip_string": {
      "description": "String to strip from model names for display.",
      "type": "string"
    },
    "editor": {
      "description": "Editor command used when opening files.",
      "type": "string"
    },
    "theme": {
      "description": "Theme name.",
      "type": "string"
    },
    "docker_container": {
      "description": "Docker container name used when managing models through Docker.",
      "type": "string"
    }
  }
}
