{
  "columns": ["Name", "Size", "Quant", "Family", "Modified", "ID"],
  "docker_container": "ollama",
  "editor": "code",
  "log_file_path": "~/.local/state/gollama/gollama.log",
  "log_level": "info",
  "ollama_api_key": "example-token",
  "ollama_api_url": "http://127.0.0.1:11434",
  "ollama_models_dir": "~/.ollama/models",
  "sort_order": "modified",
  "strip_string": "latest",
  "theme": "dark-neon"
}
